{
  "$schema": "https://json-schema.org/draft/2020-12/schema",
  "$id": "https://github.com/jabrena/plinth/benchmarks/metrics-v1.schema.json",
  "title": "Plinth project benchmark run metrics v1",
  "description": "Canonical shape for a benchmark harness run record. All top-level groups and nested fields are optional in this schema. Each scenario Gherkin feature defines which fields MUST be populated for that case.",
  "type": "object",
  "additionalProperties": false,
  "properties": {
    "efficiency": {
      "type": "object",
      "additionalProperties": false,
      "description": "Efficiency metrics for the run.",
      "properties": {
        "wall_clock_s": {
          "type": "number",
          "minimum": 0,
          "description": "Elapsed wall-clock seconds for the run."
        },
        "active_agent_s": {
          "type": "number",
          "minimum": 0,
          "description": "Seconds the agent was actively working; excludes idle wait where measurable."
        },
        "tokens_in": {
          "type": "integer",
          "minimum": 0,
          "description": "Prompt / input tokens when available."
        },
        "tokens_out": {
          "type": "integer",
          "minimum": 0,
          "description": "Completion / output tokens when available."
        },
        "tokens_total": {
          "type": "integer",
          "minimum": 0,
          "description": "Total tokens for the run. Prefer tokens_in + tokens_out when both are known."
        },
        "cost_usd": {
          "type": "number",
          "minimum": 0,
          "description": "Estimated or billed USD cost for the run."
        }
      }
    },
    "outcome_quality": {
      "type": "object",
      "additionalProperties": false,
      "description": "Outcome quality metrics for the run.",
      "properties": {
        "acceptance_pass": {
          "type": "boolean",
          "description": "Whether the run met the scenario @acceptance-test outcome and product happy path for the case."
        },
        "acceptance_coverage": {
          "type": "number",
          "minimum": 0,
          "maximum": 1,
          "description": "Share of acceptance criteria satisfied when measurable."
        },
        "rework_turns": {
          "type": "integer",
          "minimum": 0,
          "description": "Number of human or agent rework turns after the first attempt."
        },
        "artifact_completeness": {
          "type": "number",
          "minimum": 0,
          "maximum": 1,
          "description": "Whether required deliverables for the case were produced."
        }
      }
    },
    "protocol_labels": {
      "type": "object",
      "additionalProperties": false,
      "description": "Protocol labels identifying the run context.",
      "properties": {
        "scenario": {
          "type": "string",
          "enum": ["scenario1", "scenario2", "scenario3", "scenario4"],
          "description": "Folder id for the benchmark scenario."
        },
        "case_id": {
          "type": "string",
          "enum": [
            "case-1-readme-only",
            "case-2-all-problem1-requirements",
            "case-3-current-openspec-problem1",
            "case-4-current-openspec-problem1"
          ],
          "description": "Stable case id for the run."
        },
        "tool": {
          "type": "string",
          "minLength": 1,
          "description": "Agent tool used for the run (for example cursor, codex, github-copilot, claude-code)."
        },
        "model": {
          "type": "string",
          "minLength": 1,
          "description": "Model identifier used for the run."
        },
        "plinth_config": {
          "type": "string",
          "minLength": 1,
          "description": "Plinth configuration level (for example bare-agent, no-openspec, full-plinth)."
        },
        "commit": {
          "type": "string",
          "minLength": 7,
          "description": "Git commit SHA of the workspace under test when the run starts."
        },
        "retry_count": {
          "type": "integer",
          "minimum": 0,
          "description": "Number of retries for this run."
        },
        "human_intervention_min": {
          "type": "number",
          "minimum": 0,
          "description": "Minutes of human intervention during the run."
        }
      }
    },
    "plinth_usage": {
      "type": "object",
      "additionalProperties": false,
      "description": "Plinth skills and agents used during the run.",
      "properties": {
        "skills_count": {
          "type": "integer",
          "minimum": 0,
          "description": "Number of distinct skills read or invoked; MUST equal the length of skills when both are present."
        },
        "agents_count": {
          "type": "integer",
          "minimum": 0,
          "description": "Number of distinct agents or subagents invoked; MUST equal the length of agents when both are present."
        },
        "skills": {
          "type": "array",
          "items": {
            "type": "string",
            "minLength": 1
          },
          "description": "Skill ids or names used during the run; empty array when none."
        },
        "agents": {
          "type": "array",
          "items": {
            "type": "string",
            "minLength": 1
          },
          "description": "Agent ids or names invoked during the run."
        }
      }
    }
  }
}
