{
  "efficiency": {
    "wall_clock_s": 0,
    "active_agent_s": 0,
    "tokens_in": 0,
    "tokens_out": 0,
    "tokens_total": 0,
    "cost_usd": 0
  },
  "outcome_quality": {
    "acceptance_pass": false,
    "acceptance_coverage": 0,
    "rework_turns": 0,
    "artifact_completeness": 0
  },
  "protocol_labels": {
    "scenario": "scenario3",
    "case_id": "case-3-current-openspec-problem1",
    "tool": "cursor",
    "model": "replace-me",
    "plinth_config": "full-plinth",
    "commit": "replace-with-git-rev-parse-HEAD",
    "retry_count": 0,
    "human_intervention_min": 0
  },
  "plinth_usage": {
    "skills_count": 1,
    "agents_count": 1,
    "skills": ["openspec-propose"],
    "agents": ["replace-me"]
  }
}
